commit	val_mae_rev	val_mae_cogs	val_rmse_rev	ext_mae_rev	ext_mae_cogs	status	description
REF     	0.00    	0.00    	0.00    	0.00	0.00	reference	Kaggle: ex_07 LGBM v3 → 1211261
REF     	0.00    	0.00    	0.00    	0.00	0.00	reference	Kaggle: ex_09 LGBM direct → 1239862
REF     	0.00    	0.00    	0.00    	0.00	0.00	reference	Kaggle: ex_06 ensemble weighted → 963436
REF     	0.00    	0.00    	0.00    	0.00	0.00	reference	Kaggle: ex_06 ensemble optimized → 967244
REF     	0.00    	0.00    	0.00    	0.00	0.00	reference	Kaggle: ex_08 Prophet+LGBM residual → 890575 (best so far)
REF     	0.00    	0.00    	0.00    	0.00	0.00	reference	Kaggle: autoresearch tree-only baseline → 2082829 (worst, don't revert here)
0a598b8	404480.82	380207.09	508777.47	1058970.43	1191649.17	keep	baseline: Prophet + LGBM residual, v3 features
6de2bb8	404945.14	387217.76	494817.57	704383.93	734837.49	keep	exp1: log1p Prophet target
0a35016	464815.44	365366.49	558869.97	1386437.70	1090970.39	discard	exp2: log1p Prophet + exog regressors — regresses BOTH val +15% and ext +97%
b6ae9d1	393772.84	362175.61	495500.35	652014.76	737563.67	keep	exp3: log1p Prophet, changepoint_prior_scale=0.1 (was 0.05)
f5475e5	375761.38	371025.15	467553.91	643404.67	727047.07	keep	exp3b: log1p Prophet, changepoint_prior_scale=0.2
cdfaa65	406247.83	383718.33	503191.33	640441.43	715569.70	discard	exp3c: cp=0.3 overfits val (+8.1%), revert to 0.2
de52ac4	427356.22	429121.35	547828.77	735687.64	767660.97	discard	exp4: drop lag/rolling regresses both (+14%) — lag features still useful
8d3d521	403339.06	365093.63	497244.40	632955.60	697675.38	discard	exp5: country_holidays=VN regresses val +7%, ext only -1.6%
44c701c	399146.78	373656.88	508148.48	629463.25	700648.09	discard	exp6: more LGBM reg — val +6.2%, ext only -2.2% (net loss)
08b8d83	495714.80	376419.25	601146.11	603929.10	535912.66	keep	exp7: Prophet 4yr window (dampens trend extrapolation)
d6d48ea	640579.91	546755.55	892720.86	1234989.06	1022217.30	keep	exp8: Chronos-Bolt-Small zero-shot, chunked 64-step rollout
d6d48ea	406096.67	378451.45	523564.17	763442.21	684643.06	keep	exp9: seasonal-naive × damped CAGR (cap 8%)
d6d48ea	0.00	0.00	0.00	0.00	0.00	keep	exp10: blend w_prophet=0.70 targeting realistic 5.5% CAGR
d6d48ea	640579.91	546755.55	892720.86	1234989.06	1022217.30	keep	exp8: Chronos-Bolt-Small zero-shot, chunked 64-step rollout
d6d48ea	493121.94	458652.82	653473.95	1020418.89	857189.55	keep	exp8: Chronos-Bolt-Small zero-shot, chunked 64-step rollout
04e56be	437047.98	387660.92	556475.55	950262.40	917391.87	keep	exp11: Prophet changepoint_range=0.5, cp=0.1, full history
6bd51b7	406517.79	356491.38	502744.49	1017689.57	983156.45	keep	exp12: Prophet changepoint_range=0.7, cp=0.2
4f1bfa6	367234.28	338504.26	468100.73	1136983.99	1272069.73	keep	exp13: revert to ex_08 Prophet (cp=0.05, no log) + LGBM L1
62d7d1a	371822.25	338140.93	461566.57	620816.69	690420.67	keep	exp24: log1p Prophet cp=0.2 ADDITIVE + simpler LGBM (1000t/31l/high-reg)
72a8385	375868.68	329176.21	474260.61	613007.85	696861.21	keep	exp25: log1p Prophet cp=0.25 ADDITIVE + simpler LGBM (1000t/31l)
7179791	371270.27	330371.82	469419.23	613918.41	700243.03	keep	exp26: log1p Prophet cp=0.3 ADDITIVE + simpler LGBM (1000t/31l)
130d5c9	371270.27	330371.82	469419.23	613918.41	700243.03	keep	exp26: log1p Prophet cp=0.3 ADDITIVE + simpler LGBM (1000t/31l)
